<!ELEMENT component (tag,tagClass,componentClass,componentHandlerClass?,componentType,componentFamily,rendererType?,rendererClass?,parent,interfaces?,attributes,resources*)>
<!ELEMENT tagman (#PCDATA)>
<!ELEMENT tagClass (#PCDATA)>
<!ELEMENT componentClass (#PCDATA)>
<!ELEMENT componentHandlerClass (#PCDATA)>
<!ELEMENT componentType (#PCDATA)>
<!ELEMENT componentFamily (#PCDATA)>
<!ELEMENT rendererType (#PCDATA)>
<!ELEMENT rendererClass (#PCDATA)>
<!ELEMENT parent (#PCDATA)>
<!ELEMENT interfaces (interface)>
<!ELEMENT interface (name)>
<!ELEMENT attributes (attribute*)>
<!ELEMENT attribute (name,required,type,method-signature?,ignoreInComponent?,defaultValue?,description?)>
<!ELEMENT name (#PCDATA)>
<!ELEMENT required (#PCDATA)>
<!ELEMENT type (#PCDATA)>
<!ELEMENT method-signature (#PCDATA)>
<!ELEMENT ignoreInComponent (#PCDATA)>
<!ELEMENT defaultValue (#PCDATA)>
<!ELEMENT description (#PCDATA)>
<!ELEMENT resources (resource*)>
<!ELEMENT resource (name)>