<?xml version="1.0" encoding="UTF-8"?>
<!DOCTYPE component SYSTEM "../misc/component.dtd" [
<!ENTITY standard_uicomponent_attributes		SYSTEM "../entities/standard_uicomponent_attributes.xml">
<!ENTITY widget_var_attribute					SYSTEM "../entities/widget_var_attribute.xml">
]>
<component>
	<tag>ajaxStatus</tag>
	<tagClass>org.primefaces.component.ajaxstatus.AjaxStatusTag</tagClass>
	<componentClass>org.primefaces.component.ajaxstatus.AjaxStatus</componentClass>
	<componentType>org.primefaces.component.AjaxStatus</componentType>
	<componentFamily>org.primefaces.component</componentFamily>
	<rendererType>org.primefaces.component.AjaxStatusRenderer</rendererType>
	<rendererClass>org.primefaces.component.ajaxstatus.AjaxStatusRenderer</rendererClass>
	<parent>javax.faces.component.UIComponentBase</parent>
    <interfaces>
		<interface>
			<name>org.primefaces.component.api.Widget</name>
		</interface>
	</interfaces>
	<attributes>
		&standard_uicomponent_attributes;
		&widget_var_attribute;
		<attribute>
			<name>onstart</name>
			<required>false</required>
			<type>java.lang.String</type>
		</attribute>
		<attribute>
			<name>oncomplete</name>
			<required>false</required>
			<type>java.lang.String</type>
		</attribute>
		<attribute>
			<name>onprestart</name>
			<required>false</required>
			<type>java.lang.String</type>
		</attribute>
		<attribute>
			<name>onsuccess</name>
			<required>false</required>
			<type>java.lang.String</type>
		</attribute>
		<attribute>
			<name>onerror</name>
			<required>false</required>
			<type>java.lang.String</type>
		</attribute>
		<attribute>
			<name>style</name>
			<required>false</required>
			<type>java.lang.String</type>
		</attribute>
		<attribute>
			<name>styleClass</name>
			<required>false</required>
			<type>java.lang.String</type>
		</attribute>
	</attributes>
	<resources>
		<resource>
			<name>jquery/jquery.js</name>
		</resource>
		<resource>
			<name>core/core.js</name>
		</resource>
		<resource>
			<name>ajaxstatus/ajaxstatus.js</name>
		</resource>
	</resources>
</component>