<?xml version="1.0" encoding="UTF-8"?>
<!DOCTYPE component SYSTEM "../misc/component.dtd" [
<!ENTITY standard_uicomponent_attributes		SYSTEM "../entities/standard_uicomponent_attributes.xml">
<!ENTITY widget_var_attribute					SYSTEM "../entities/widget_var_attribute.xml">
]>
<component>
    <tag>wizard</tag>
    <tagClass>org.primefaces.component.wizard.WizardTag</tagClass>
    <componentClass>org.primefaces.component.wizard.Wizard</componentClass>
    <componentHandlerClass>org.primefaces.component.wizard.WizardHandler</componentHandlerClass>
    <componentType>org.primefaces.component.Wizard</componentType>
    <componentFamily>org.primefaces.component</componentFamily>
    <rendererType>org.primefaces.component.WizardRenderer</rendererType>
    <rendererClass>org.primefaces.component.wizard.WizardRenderer</rendererClass>
    <parent>javax.faces.component.UIComponentBase</parent>
     <interfaces>
		<interface>
			<name>org.primefaces.component.api.Widget</name>
		</interface>
	</interfaces>
    <attributes>
        &standard_uicomponent_attributes;
        &widget_var_attribute;
        <attribute>
            <name>step</name>
            <required>false</required>
            <type>java.lang.String</type>
        </attribute>
        <attribute>
            <name>style</name>
            <required>false</required>
            <type>java.lang.String</type>
        </attribute>
        <attribute>
            <name>styleClass</name>
            <required>false</required>
            <type>java.lang.String</type>
        </attribute>
        <attribute>
            <name>flowListener</name>
            <required>false</required>
            <type>javax.el.MethodExpression</type>
            <method-signature>void flowListener()</method-signature>
        </attribute>
        <attribute>
            <name>showNavBar</name>
            <required>false</required>
            <type>java.lang.Boolean</type>
            <defaultValue>true</defaultValue>
        </attribute>
        <attribute>
            <name>onback</name>
            <required>false</required>
            <type>java.lang.String</type>
        </attribute>
        <attribute>
            <name>onnext</name>
            <required>false</required>
            <type>java.lang.String</type>
        </attribute>
        <attribute>
            <name>nextLabel</name>
            <required>false</required>
            <type>java.lang.String</type>
            <defaultValue>Next</defaultValue>
        </attribute>
        <attribute>
            <name>backLabel</name>
            <required>false</required>
            <type>java.lang.String</type>
            <defaultValue>Back</defaultValue>
        </attribute>
        <attribute>
            <name>effect</name>
            <required>false</required>
            <type>java.lang.Boolean</type>
            <defaultValue>true</defaultValue>
        </attribute>
        <attribute>
            <name>effectSpeed</name>
            <required>false</required>
            <type>java.lang.String</type>
            <defaultValue>normal</defaultValue>
        </attribute>
    </attributes>
    <resources>
        <resource>
            <name>wizard/wizard.css</name>
        </resource>
        <resource>
			<name>jquery/ui/jquery-ui.css</name>
		</resource>
		<resource>
			<name>jquery/jquery.js</name>
		</resource>
		<resource>
			<name>jquery/ui/jquery-ui.js</name>
		</resource>
        <resource>
            <name>core/core.js</name>
        </resource>
        <resource>
            <name>wizard/wizard.js</name>
        </resource>
    </resources>
</component>