<?xml version="1.0" encoding="UTF-8"?>
<!DOCTYPE component SYSTEM "../misc/component.dtd" [
<!ENTITY standard_uicomponent_attributes		SYSTEM "../entities/standard_uicomponent_attributes.xml">
<!ENTITY widget_var_attribute					SYSTEM "../entities/widget_var_attribute.xml">
]>
<component>
	<tag>spreadsheet</tag>
	<tagClass>org.primefaces.component.spreadsheet.SpreadsheetTag</tagClass>
	<componentClass>org.primefaces.component.spreadsheet.Spreadsheet</componentClass>
	<componentType>org.primefaces.component.Spreadsheet</componentType>
	<componentFamily>org.primefaces.component</componentFamily>
	<rendererType>org.primefaces.component.SpreadsheetRenderer</rendererType>
	<rendererClass>org.primefaces.component.spreadsheet.SpreadsheetRenderer</rendererClass>
	<parent>javax.faces.component.UIComponentBase</parent>
     <interfaces>
		<interface>
			<name>org.primefaces.component.api.Widget</name>
		</interface>
	</interfaces>
	<attributes>
		&standard_uicomponent_attributes;
		&widget_var_attribute;
		<attribute>
			<name>title</name>
			<required>false</required>
			<type>java.lang.String</type>
		</attribute>
		<attribute>
			<name>editable</name>
			<required>false</required>
			<type>java.lang.Boolean</type>
			<defaultValue>true</defaultValue>
		</attribute>
		<attribute>
			<name>columnWidth</name>
			<required>false</required>
			<type>java.lang.Integer</type>
			<defaultValue>java.lang.Integer.MIN_VALUE</defaultValue>
		</attribute>
	</attributes>
	<resources>
		<resource>
			<name>sheet/sheet.css</name>
		</resource>
		<resource>
			<name>jquery/jquery.js</name>
		</resource>
		<resource>
			<name>jquery/ui/jquery-ui.js</name>
		</resource>
        <resource>
			<name>core/core.js</name>
		</resource>
		<resource>
			<name>sheet/sheet.js</name>
		</resource>
	</resources>
</component>