<?xml version="1.0" encoding="UTF-8"?>
<!DOCTYPE component SYSTEM "../misc/component.dtd" [
<!ENTITY standard_uicomponent_attributes		SYSTEM "../entities/standard_uicomponent_attributes.xml">
<!ENTITY widget_var_attribute					SYSTEM "../entities/widget_var_attribute.xml">
]>
<component>
	<tag>button</tag>
	<tagClass>org.primefaces.component.button.ButtonTag</tagClass>
	<componentClass>org.primefaces.component.button.Button</componentClass>
	<componentType>org.primefaces.component.Button</componentType>
	<componentFamily>org.primefaces.component</componentFamily>
	<rendererType>org.primefaces.component.ButtonRenderer</rendererType>
	<rendererClass>org.primefaces.component.button.ButtonRenderer</rendererClass>
	<parent>javax.faces.component.html.HtmlOutcomeTargetButton</parent>
    <interfaces>
		<interface>
			<name>org.primefaces.component.api.Widget</name>
		</interface>
	</interfaces>
	<attributes>
		&standard_uicomponent_attributes;
		&widget_var_attribute;
		<attribute>
			<name>fragment</name>
			<type>java.lang.String</type>
		</attribute>
	</attributes>
	<resources>
		<resource>
			<name>jquery/ui/jquery-ui.css</name>
		</resource>
		<resource>
			<name>jquery/jquery.js</name>
		</resource>
		<resource>
			<name>jquery/ui/jquery-ui.js</name>
		</resource>
		<resource>
			<name>core/core.js</name>
		</resource>
		<resource>
			<name>button/button.js</name>
		</resource>
	</resources>
</component>