<?xml version="1.0" encoding="UTF-8"?>
<!DOCTYPE component SYSTEM "../misc/component.dtd" [
<!ENTITY standard_uicomponent_attributes		SYSTEM "../entities/standard_uicomponent_attributes.xml">
<!ENTITY output_component_attributes			SYSTEM "../entities/output_component_attributes.xml">
<!ENTITY input_component_attributes				SYSTEM "../entities/input_component_attributes.xml">
<!ENTITY widget_var_attribute					SYSTEM "../entities/widget_var_attribute.xml">
]>
<component>
	<tag>imageCropper</tag>
	<tagClass>org.primefaces.component.imagecropper.ImageCropperTag</tagClass>
	<componentClass>org.primefaces.component.imagecropper.ImageCropper</componentClass>
	<componentType>org.primefaces.component.ImageCropper</componentType>
	<componentFamily>org.primefaces.component</componentFamily>
	<rendererType>org.primefaces.component.ImageCropperRenderer</rendererType>
	<rendererClass>org.primefaces.component.imagecropper.ImageCropperRenderer</rendererClass>
	<parent>javax.faces.component.UIInput</parent>
    <interfaces>
		<interface>
			<name>org.primefaces.component.api.Widget</name>
		</interface>
	</interfaces>
	<attributes>
		&input_component_attributes;
		&widget_var_attribute;
		<attribute>
			<name>image</name>
			<required>false</required>
			<type>java.lang.String</type>
		</attribute>
        <attribute>
			<name>alt</name>
			<required>false</required>
			<type>java.lang.String</type>
		</attribute>
        <attribute>
			<name>aspectRatio</name>
			<required>false</required>
			<type>java.lang.Double</type>
            <defaultValue>java.lang.Double.MIN_VALUE</defaultValue>
		</attribute>
        <attribute>
			<name>minSize</name>
			<required>false</required>
			<type>java.lang.String</type>
		</attribute>
        <attribute>
			<name>maxSize</name>
			<required>false</required>
			<type>java.lang.String</type>
		</attribute>
        <attribute>
			<name>backgroundColor</name>
			<required>false</required>
			<type>java.lang.String</type>
		</attribute>
        <attribute>
			<name>backgroundOpacity</name>
			<required>false</required>
			<type>java.lang.Double</type>
            <defaultValue>0.6</defaultValue>
		</attribute>
        <attribute>
			<name>initialCoords</name>
			<required>false</required>
			<type>java.lang.String</type>
		</attribute>
	</attributes>
	<resources>
		<resource>
			<name>imagecropper/imagecropper.css</name>
		</resource>
		<resource>
			<name>jquery/jquery.js</name>
		</resource>
		<resource>
			<name>core/core.js</name>
		</resource>
		<resource>
			<name>imagecropper/imagecropper.js</name>
		</resource>
	</resources>
</component>