<?xml version="1.0" encoding="UTF-8"?>
<!DOCTYPE component SYSTEM "../misc/component.dtd" [
<!ENTITY standard_uicomponent_attributes		SYSTEM "../entities/standard_uicomponent_attributes.xml">
]>
<component>
	<tag>headerRow</tag>
	<tagClass>org.primefaces.component.headerrow.HeaderRowTag</tagClass>
	<componentClass>org.primefaces.component.headerrow.HeaderRow</componentClass>
	<componentType>org.primefaces.component.HeaderRow</componentType>
	<componentFamily>org.primefaces.component</componentFamily>
	<parent>javax.faces.component.UIComponentBase</parent>
	<attributes>
		&standard_uicomponent_attributes;
	</attributes>
</component>
