<?xml version="1.0" encoding="UTF-8"?>
<!DOCTYPE component SYSTEM "../misc/component.dtd" [
<!ENTITY standard_uicomponent_attributes		SYSTEM "../entities/standard_uicomponent_attributes.xml">
<!ENTITY output_component_attributes			SYSTEM "../entities/output_component_attributes.xml">
<!ENTITY input_component_attributes             SYSTEM "../entities/input_component_attributes.xml">
<!ENTITY widget_var_attribute					SYSTEM "../entities/widget_var_attribute.xml">
]>
<component>
	<tag>checkButton</tag>
	<tagClass>org.primefaces.component.checkbutton.CheckButtonTag</tagClass>
	<componentClass>org.primefaces.component.checkbutton.CheckButton</componentClass>
	<componentType>org.primefaces.component.CheckButton</componentType>
	<componentFamily>org.primefaces.component</componentFamily>
	<rendererType>org.primefaces.component.CheckButtonRenderer</rendererType>
	<rendererClass>org.primefaces.component.checkbutton.CheckButtonRenderer</rendererClass>
	<parent>javax.faces.component.UIInput</parent>
	<interfaces>
        <interface>
			<name>org.primefaces.component.api.Widget</name>
		</interface>
	</interfaces>
	<attributes>
		&input_component_attributes;
		&widget_var_attribute;
        <attribute>
			<name>label</name>
			<required>false</required>
			<type>java.lang.String</type>
			<description>
				Label of the button when checked
			</description>
		</attribute>
	</attributes>
	<resources>
		<resource>
			<name>jquery/ui/jquery-ui.css</name>
		</resource>
		<resource>
			<name>jquery/jquery.js</name>
		</resource>
		<resource>
			<name>jquery/ui/jquery-ui.js</name>
		</resource>
		<resource>
			<name>core/core.js</name>
		</resource>
		<resource>
			<name>button/button.js</name>
		</resource>
	</resources>
</component>