<?xml version="1.0" encoding="UTF-8"?>
<!DOCTYPE component SYSTEM "../misc/component.dtd" [
<!ENTITY standard_uicomponent_attributes		SYSTEM "../entities/standard_uicomponent_attributes.xml">
<!ENTITY widget_var_attribute					SYSTEM "../entities/widget_var_attribute.xml">
]>
<component>
	<tag>accordionPanel</tag>
	<tagClass>org.primefaces.component.accordionpanel.AccordionPanelTag</tagClass>
	<componentClass>org.primefaces.component.accordionpanel.AccordionPanel</componentClass>
    <componentHandlerClass>org.primefaces.component.accordionpanel.AccordionPanelHandler</componentHandlerClass>
	<componentType>org.primefaces.component.AccordionPanel</componentType>
	<componentFamily>org.primefaces.component</componentFamily>
	<rendererType>org.primefaces.component.AccordionPanelRenderer</rendererType>
	<rendererClass>org.primefaces.component.accordionpanel.AccordionPanelRenderer</rendererClass>
	<parent>javax.faces.component.UIPanel</parent>
    <interfaces>
		<interface>
			<name>org.primefaces.component.api.Widget</name>
		</interface>
	</interfaces>
	<attributes>
		&standard_uicomponent_attributes;
		&widget_var_attribute;
		<attribute>
			<name>activeIndex</name>
			<required>false</required>
			<type>java.lang.Integer</type>
			<defaultValue>0</defaultValue>
			<description>Index of the active tab.</description>
		</attribute>
		<attribute>
			<name>style</name>
			<required>false</required>
			<type>java.lang.String</type>
			<description>Style of the root container of accordion panel</description>
		</attribute>
		<attribute>
			<name>styleClass</name>
			<required>false</required>
			<type>java.lang.String</type>
			<description>Style class of the root container of accordion panel</description>
		</attribute>
		<attribute>
			<name>disabled</name>
			<required>false</required>
			<type>java.lang.Boolean</type>
			<defaultValue>false</defaultValue>
			<description>Disables or enables accordion</description>
		</attribute>
		<attribute>
			<name>effect</name>
			<required>false</required>
			<type>java.lang.String</type>
			<defaultValue>slide</defaultValue>
			<description>Effect to use when toggling the content</description>
		</attribute>
		<attribute>
			<name>autoHeight</name>
			<required>false</required>
			<type>java.lang.Boolean</type>
			<defaultValue>true</defaultValue>
			<description>When enabled, highest content is used as the reference. Provides more consistent animations.</description>
		</attribute>
		<attribute>
			<name>collapsible</name>
			<required>false</required>
			<type>java.lang.Boolean</type>
			<defaultValue>false</defaultValue>
			<description>Defines if accordion can be collapsed all together.</description>
		</attribute>
		<attribute>
			<name>fillSpace</name>
			<required>false</required>
			<type>java.lang.Boolean</type>
			<defaultValue>false</defaultValue>
			<description>When enabled, accordion fills the height of it's parent.</description>
		</attribute>
		<attribute>
			<name>event</name>
			<required>false</required>
			<type>java.lang.String</type>
			<description>Specifies the event to use to toggle a tab.</description>
		</attribute>
        <attribute>
            <name>tabChangeListener</name>
            <required>false</required>
            <type>javax.el.MethodExpression</type>
            <method-signature>void tabChangeListener(org.primefaces.event.TabChangeEvent)</method-signature>
            <description>Server side listener to invoke when a tab has changed.</description>
        </attribute>
        <attribute>
            <name>onTabChangeUpdate</name>
            <required>false</required>
            <type>java.lang.String</type>
            <description>Component(s) to update after tabChangeListener is invoked.</description>
        </attribute>
        <attribute>
            <name>onTabChange</name>
            <required>false</required>
            <type>java.lang.String</type>
            <description>Client side callback to invoke when active tab changes.</description>
        </attribute>
        <attribute>
            <name>dynamic</name>
            <required>false</required>
            <type>java.lang.Boolean</type>
            <defaultValue>false</defaultValue>
            <description>Specifies the toggleMode, dynamic setting fetches it's content with ajax on tab switch.</description>
        </attribute>
        <attribute>
            <name>cache</name>
            <required>false</required>
            <type>java.lang.Boolean</type>
            <defaultValue>true</defaultValue>
            <description>When tab contents are lazy loaded by ajax toggleMode, caching only retrieves the tab contents once and subsequent toggles of a cached tab
			does not communicate with server. If caching is turned off, tab contents are refetched from server each time tab is clicked. This setting is true by default.
            </description>
        </attribute>
	</attributes>
	<resources>
		<resource>
			<name>jquery/ui/jquery-ui.css</name>
		</resource>
		<resource>
			<name>jquery/jquery.js</name>
		</resource>
		<resource>
			<name>jquery/ui/jquery-ui.js</name>
		</resource>	
		<resource>
			<name>core/core.js</name>
		</resource>
		<resource>
			<name>accordion/accordion.js</name>
		</resource>
	</resources>
</component>