<?xml version="1.0" encoding="UTF-8"?>
<!DOCTYPE component SYSTEM "../misc/component.dtd" [
<!ENTITY standard_uicomponent_attributes		SYSTEM "../entities/standard_uicomponent_attributes.xml">
<!ENTITY command_component_attributes			SYSTEM "../entities/command_component_attributes.xml">
]>
<component>
    <tag>remoteCommand</tag>
    <tagClass>org.primefaces.component.remotecommand.RemoteCommandTag</tagClass>
    <componentClass>org.primefaces.component.remotecommand.RemoteCommand</componentClass>
    <componentType>org.primefaces.component.RemoteCommand</componentType>
    <componentFamily>org.primefaces.component</componentFamily>
    <rendererType>org.primefaces.component.RemoteCommandRenderer</rendererType>
    <rendererClass>org.primefaces.component.remotecommand.RemoteCommandRenderer</rendererClass>
    <parent>javax.faces.component.UICommand</parent>
    <interfaces>
        <interface>
            <name>org.primefaces.component.api.AjaxSource</name>
        </interface>
    </interfaces>
    <attributes>
        &command_component_attributes;
        <attribute>
            <name>name</name>
            <required>false</required>
            <type>java.lang.String</type>
        </attribute>
        <attribute>
            <name>update</name>
            <required>false</required>
            <type>java.lang.String</type>
        </attribute>
        <attribute>
            <name>process</name>
            <required>false</required>
            <type>java.lang.String</type>
        </attribute>
        <attribute>
            <name>onstart</name>
            <required>false</required>
            <type>java.lang.String</type>
        </attribute>
        <attribute>
            <name>oncomplete</name>
            <required>false</required>
            <type>java.lang.String</type>
        </attribute>
        <attribute>
            <name>onerror</name>
            <required>false</required>
            <type>java.lang.String</type>
        </attribute>
        <attribute>
            <name>onsuccess</name>
            <required>false</required>
            <type>java.lang.String</type>
        </attribute>
        <attribute>
            <name>global</name>
            <required>false</required>
            <type>java.lang.Boolean</type>
            <defaultValue>true</defaultValue>
        </attribute>
        <attribute>
            <name>async</name>
            <required>false</required>
            <type>java.lang.Boolean</type>
            <defaultValue>false</defaultValue>
        </attribute>
    </attributes>
    <resources>
        <resource>
            <name>jquery/jquery.js</name>
        </resource>
        <resource>
            <name>core/core.js</name>
        </resource>
    </resources>
</component>