<?xml version="1.0" encoding="UTF-8"?>
<!DOCTYPE component SYSTEM "../misc/component.dtd" [
<!ENTITY standard_uicomponent_attributes		SYSTEM "../entities/standard_uicomponent_attributes.xml">
]>
<component>
    <tag>hotkey</tag>
    <tagClass>org.primefaces.component.hotkey.HotkeyTag</tagClass>
    <componentClass>org.primefaces.component.hotkey.Hotkey</componentClass>
    <componentType>org.primefaces.component.Hotkey</componentType>
    <componentFamily>org.primefaces.component</componentFamily>
    <rendererType>org.primefaces.component.HotkeyRenderer</rendererType>
    <rendererClass>org.primefaces.component.hotkey.HotkeyRenderer</rendererClass>
    <parent>javax.faces.component.UICommand</parent>
    <interfaces>
        <interface>
            <name>org.primefaces.component.api.AjaxSource</name>
        </interface>
    </interfaces>
    <attributes>
        &standard_uicomponent_attributes;
        <attribute>
            <name>actionListener</name>
            <required>false</required>
            <type>javax.faces.event.ActionListener</type>
            <method-signature>void actionListener(javax.faces.event.ActionEvent)</method-signature>
            <ignoreInComponent>true</ignoreInComponent>
        </attribute>
        <attribute>
            <name>action</name>
            <required>false</required>
            <type>javax.el.MethodExpression</type>
            <method-signature>java.lang.Object action()</method-signature>
            <ignoreInComponent>true</ignoreInComponent>
        </attribute>
        <attribute>
            <name>immediate</name>
            <required>false</required>
            <type>java.lang.Boolean</type>
            <defaultValue>false</defaultValue>
            <ignoreInComponent>true</ignoreInComponent>
        </attribute>
        <attribute>
            <name>bind</name>
            <required>true</required>
            <type>java.lang.String</type>
        </attribute>
        <attribute>
            <name>update</name>
            <required>false</required>
            <type>java.lang.String</type>
        </attribute>
        <attribute>
            <name>process</name>
            <required>false</required>
            <type>java.lang.String</type>
        </attribute>
        <attribute>
            <name>handler</name>
            <required>false</required>
            <type>java.lang.String</type>
        </attribute>
        <attribute>
            <name>onstart</name>
            <required>false</required>
            <type>java.lang.String</type>
        </attribute>
        <attribute>
            <name>oncomplete</name>
            <required>false</required>
            <type>java.lang.String</type>
        </attribute>
        <attribute>
            <name>onerror</name>
            <required>false</required>
            <type>java.lang.String</type>
        </attribute>
        <attribute>
            <name>onsuccess</name>
            <required>false</required>
            <type>java.lang.String</type>
        </attribute>
        <attribute>
            <name>global</name>
            <required>false</required>
            <type>java.lang.Boolean</type>
            <defaultValue>true</defaultValue>
        </attribute>
        <attribute>
            <name>async</name>
            <required>false</required>
            <type>java.lang.Boolean</type>
            <defaultValue>false</defaultValue>
        </attribute>
    </attributes>
    <resources>
        <resource>
            <name>jquery/jquery.js</name>
        </resource>
        <resource>
            <name>hotkey/jquery.hotkeys.js</name>
        </resource>
        <resource>
            <name>core/core.js</name>
        </resource>
    </resources>
</component>
