<?xml version="1.0" encoding="UTF-8"?>
<!DOCTYPE component SYSTEM "../misc/component.dtd" [
<!ENTITY standard_uicomponent_attributes		SYSTEM "../entities/standard_uicomponent_attributes.xml">
]>
<component>
    <tag>columns</tag>
    <tagClass>org.primefaces.component.columns.ColumnsTag</tagClass>
    <componentClass>org.primefaces.component.columns.Columns</componentClass>
    <componentType>org.primefaces.component.Columns</componentType>
    <componentFamily>org.primefaces.component</componentFamily>
    <parent>javax.faces.component.UIColumn</parent>
    <attributes>
		&standard_uicomponent_attributes;
        <attribute>
            <name>value</name>
            <required>false</required>
            <type>java.lang.Object</type>
            <description>
                Value referring to a collection of columns.
            </description>
        </attribute>
        <attribute>
            <name>var</name>
            <required>true</required>
            <type>java.lang.String</type>
            <description>
                Name of the request-scoped variable that'll be used as the holder of each column.
            </description>
        </attribute>
        <attribute>
            <name>columnIndexVar</name>
            <required>true</required>
            <type>java.lang.String</type>
            <description>
                Name of the request-scoped variable that'll be used as the holder of each column index.
            </description>
        </attribute>
    </attributes>
</component>
