<?xml version="1.0" encoding="UTF-8"?>
<!DOCTYPE component SYSTEM "../misc/component.dtd" [
<!ENTITY standard_uicomponent_attributes		SYSTEM "../entities/standard_uicomponent_attributes.xml">
]>
<component>
	<tag>divider</tag>
	<tagClass>org.primefaces.component.divider.DividerTag</tagClass>
	<componentClass>org.primefaces.component.divider.Divider</componentClass>
	<componentType>org.primefaces.component.Divider</componentType>
	<componentFamily>org.primefaces.component</componentFamily>
    <rendererType>org.primefaces.component.DividerRenderer</rendererType>
	<rendererClass>org.primefaces.component.divider.DividerRenderer</rendererClass>
	<parent>javax.faces.component.UIComponentBase</parent>
	<attributes>
		&standard_uicomponent_attributes;
         <attribute>
            <name>style</name>
            <required>false</required>
            <type>java.lang.String</type>
            <description></description>
        </attribute>
        <attribute>
            <name>styleClass</name>
            <required>false</required>
            <type>java.lang.String</type>
            <description></description>
        </attribute>
        <attribute>
            <name>type</name>
            <required>false</required>
            <type>java.lang.String</type>
            <defaultValue>dotted</defaultValue>
            <description></description>
        </attribute>
	</attributes>
</component>