<?xml version="1.0" encoding="UTF-8"?>
<!DOCTYPE component SYSTEM "../misc/component.dtd" [
<!ENTITY standard_uicomponent_attributes		SYSTEM "../entities/standard_uicomponent_attributes.xml">
<!ENTITY output_component_attributes			SYSTEM "../entities/output_component_attributes.xml">
<!ENTITY command_component_attributes			SYSTEM "../entities/command_component_attributes.xml">
<!ENTITY widget_var_attribute					SYSTEM "../entities/widget_var_attribute.xml">
<!ENTITY html_command_button_attributes			SYSTEM "../entities/html_command_button_attributes.xml">
]>
<component>
	<tag>commandButton</tag>
	<tagClass>org.primefaces.component.commandbutton.CommandButtonTag</tagClass>
	<componentClass>org.primefaces.component.commandbutton.CommandButton</componentClass>
	<componentType>org.primefaces.component.CommandButton</componentType>
	<componentFamily>org.primefaces.component</componentFamily>
	<rendererType>org.primefaces.component.CommandButtonRenderer</rendererType>
	<rendererClass>org.primefaces.component.commandbutton.CommandButtonRenderer</rendererClass>
	<parent>javax.faces.component.html.HtmlCommandButton</parent>
	<interfaces>
		<interface>
			<name>org.primefaces.component.api.AjaxSource</name>
		</interface>
        <interface>
			<name>org.primefaces.component.api.Widget</name>
		</interface>
	</interfaces>
	<attributes>
		&command_component_attributes;
		&widget_var_attribute;
		<attribute>
			<name>ajax</name>
			<required>false</required>
			<type>java.lang.Boolean</type>
			<defaultValue>true</defaultValue>
		</attribute>
		<attribute>
			<name>async</name>
			<required>false</required>
			<type>java.lang.Boolean</type>
			<defaultValue>false</defaultValue>
		</attribute>
		<attribute>
			<name>process</name>
			<required>false</required>
			<type>java.lang.String</type>
		</attribute>
		<attribute>
			<name>update</name>
			<required>false</required>
			<type>java.lang.String</type>
		</attribute>
		<attribute>
			<name>onstart</name>
			<required>false</required>
			<type>java.lang.String</type>
		</attribute>
		<attribute>
			<name>oncomplete</name>
			<required>false</required>
			<type>java.lang.String</type>
		</attribute>
		<attribute>
			<name>onerror</name>
			<required>false</required>
			<type>java.lang.String</type>
		</attribute>
		<attribute>
			<name>onsuccess</name>
			<required>false</required>
			<type>java.lang.String</type>
		</attribute>
		<attribute>
			<name>global</name>
			<required>false</required>
			<type>java.lang.Boolean</type>
			<defaultValue>true</defaultValue>
		</attribute>
		<attribute>
			<name>accesskey</name>
			<required>false</required>
			<type>java.lang.String</type>
			<ignoreInComponent>true</ignoreInComponent>
		</attribute>
		<attribute>
			<name>alt</name>
			<required>false</required>
			<type>java.lang.String</type>
			<ignoreInComponent>true</ignoreInComponent>
		</attribute>
		<attribute>
			<name>dir</name>
			<required>false</required>
			<type>java.lang.String</type>
			<ignoreInComponent>true</ignoreInComponent>
		</attribute>
		<attribute>
			<name>disabled</name>
			<required>false</required>
			<type>java.lang.String</type>
			<ignoreInComponent>true</ignoreInComponent>
		</attribute>
		<attribute>
			<name>image</name>
			<required>false</required>
			<type>java.lang.String</type>
			<ignoreInComponent>true</ignoreInComponent>
		</attribute>
		<attribute>
			<name>label</name>
			<required>false</required>
			<type>java.lang.String</type>
			<ignoreInComponent>true</ignoreInComponent>
		</attribute>
		<attribute>
			<name>lang</name>
			<required>false</required>
			<type>java.lang.String</type>
			<ignoreInComponent>true</ignoreInComponent>
		</attribute>
		<attribute>
			<name>tabindex</name>
			<required>false</required>
			<type>java.lang.String</type>
			<ignoreInComponent>true</ignoreInComponent>
		</attribute>
		<attribute>
			<name>title</name>
			<required>false</required>
			<type>java.lang.String</type>
			<ignoreInComponent>true</ignoreInComponent>
		</attribute>
		<attribute>
			<name>type</name>
			<required>false</required>
			<type>java.lang.String</type>
			<ignoreInComponent>true</ignoreInComponent>
		</attribute>
		<attribute>
			<name>readonly</name>
			<required>false</required>
			<type>java.lang.String</type>
			<ignoreInComponent>true</ignoreInComponent>
		</attribute>
		<attribute>
			<name>style</name>
			<required>false</required>
			<type>java.lang.String</type>
			<ignoreInComponent>true</ignoreInComponent>
		</attribute>
		<attribute>
			<name>styleClass</name>
			<required>false</required>
			<type>java.lang.String</type>
			<ignoreInComponent>true</ignoreInComponent>
		</attribute>
		<attribute>
			<name>onblur</name>
			<required>false</required>
			<type>java.lang.String</type>
			<ignoreInComponent>true</ignoreInComponent>
		</attribute>
		<attribute>
			<name>onchange</name>
			<required>false</required>
			<type>java.lang.String</type>
			<ignoreInComponent>true</ignoreInComponent>
		</attribute>
		<attribute>
			<name>onclick</name>
			<required>false</required>
			<type>java.lang.String</type>
			<ignoreInComponent>true</ignoreInComponent>
		</attribute>
		<attribute>
			<name>ondblclick</name>
			<required>false</required>
			<type>java.lang.String</type>
			<ignoreInComponent>true</ignoreInComponent>
		</attribute>
		<attribute>
			<name>onfocus</name>
			<required>false</required>
			<type>java.lang.String</type>
			<ignoreInComponent>true</ignoreInComponent>
		</attribute>
		<attribute>
			<name>onkeydown</name>
			<required>false</required>
			<type>java.lang.String</type>
			<ignoreInComponent>true</ignoreInComponent>
		</attribute>
		<attribute>
			<name>onkeypress</name>
			<required>false</required>
			<type>java.lang.String</type>
			<ignoreInComponent>true</ignoreInComponent>
		</attribute>
		<attribute>
			<name>onkeyup</name>
			<required>false</required>
			<type>java.lang.String</type>
			<ignoreInComponent>true</ignoreInComponent>
		</attribute>
		<attribute>
			<name>onmousedown</name>
			<required>false</required>
			<type>java.lang.String</type>
			<ignoreInComponent>true</ignoreInComponent>
		</attribute>
		<attribute>
			<name>onmousemove</name>
			<required>false</required>
			<type>java.lang.String</type>
			<ignoreInComponent>true</ignoreInComponent>
		</attribute>
		<attribute>
			<name>onmouseout</name>
			<required>false</required>
			<type>java.lang.String</type>
			<ignoreInComponent>true</ignoreInComponent>
		</attribute>
		<attribute>
			<name>onmouseover</name>
			<required>false</required>
			<type>java.lang.String</type>
			<ignoreInComponent>true</ignoreInComponent>
		</attribute>
		<attribute>
			<name>onmouseup</name>
			<required>false</required>
			<type>java.lang.String</type>
			<ignoreInComponent>true</ignoreInComponent>
		</attribute>
		<attribute>
			<name>onselect</name>
			<required>false</required>
			<type>java.lang.String</type>
			<ignoreInComponent>true</ignoreInComponent>
		</attribute>
	</attributes>
	<resources>
		<resource>
			<name>jquery/ui/jquery-ui.css</name>
		</resource>
		<resource>
			<name>jquery/jquery.js</name>
		</resource>
		<resource>
			<name>jquery/ui/jquery-ui.js</name>
		</resource>
		<resource>
			<name>core/core.js</name>
		</resource>
		<resource>
			<name>button/button.js</name>
		</resource>
	</resources>
</component>